,LocationType,Type,Name,Address,City,Latitude,Longitude
0,Branch,KCU,KCU MENARA BCA,"Menara BCA, Grand Indonesia Lt. 28 Jl. MH Thamrin No. 1",Jakarta Pusat,-6.197056,106.822345
1,Branch,KCU,KCU THAMRIN,"Menara BCA, Grand Indonesia, Jl. MH Thamrin No. 1",Jakarta Pusat,-6.196485,106.822252
2,Branch,KCU,KCU CITY TOWER,"The City Tower, Ground Floor, Jl. MH. Thamrin No. 81",Jakarta Pusat,-6.199065,106.823598
3,Branch,KCP,KCP Thamrin Nine,"Thamrin Nine Podium Area - UG Unit A, Jl. MH Thamrin No. 10",Jakarta Pusat,-6.199432,106.822763
4,Branch,KCP,KCP Mall Grand Indonesia,"Gedung Grand Indonesia Mall A, Lower Ground No. 20-21, Jl. MH Thamrin No. 1",Jakarta Pusat,-6.195481,106.819717
5,Branch,KCP,KCP Plaza Index,"Gedung Plaza Bank Index Ground Floor Suite GF-21, Jl. MH. Thamrin No. 57, Jakarta",Jakarta Pusat,-6.192286,106.823415
6,Branch,KCP,KCP Menteng,Jl. HOS Cokroaminoto No. 83,Jakarta Pusat,-6.197455,106.828705
7,Branch,KK,KK Kantor Kas Thamrin City,"Gd. Thamrin City Lt. Dasar 1 Tower Cosmo Terrace CT/CL/1, Jl. MH Thamrin Boulevard (d/h Kebon Kacang Raya)",Jakarta Pusat,-6.1943,106.81663
8,Branch,KCP,KCP Empat Enam,"Wisma 46 Lantai Dasar, Jl. Jend. Sudirman Kav. 1",Jakarta Pusat,-6.203499,106.820096
9,Branch,KCP,KCP Wisma Indocement,"Wisma Indocement, Gd.Annex Lt. Dasar, Jl. Jend. Sudirman Kav. 1",Jakarta Selatan,-6.205066,106.823236
10,Branch,KCP,KCP Sabang,Jl. H. Agus Salim 57 B,Jakarta Pusat,-6.186537,106.825284
11,Branch,KCU,KCU WAHID HASYIM,Jl. KH. Wahid Hasyim No. 183 A-B,Jakarta Pusat,-6.187387,106.816771
12,Branch,KCP,KCP Wahid Hasyim,Jl. KH Wahid Hasyim 82,Jakarta Pusat,-6.186814,106.827869
13,Branch,KCP,KCP Menara Thamrin,"Menara Thamrin Lantai 1 Ruang 106, Jl. MH. Thamrin Kav. 3, Jakarta",Jakarta Pusat,-6.185555,106.822797
14,Branch,KK,KK Kantor Kas Metro Tanah Abang,Pusat Grosir Metro Tanah Abang LG Blk A,Jakarta Pusat,-6.187744,106.815966
15,Branch,KCP,KCP Metro Tanah Abang,Pusat Grosir Metro Tanah Abang 2 Lt. 7 No. 10 Jl. KH Wahid Hasyim No. 189,Jakarta Pusat,-6.187744,106.815966
16,Branch,KCP,KCP Reg.Tanah Abang,"Pasar Regional Tanah Abang Blok F, Lt. Dasar",Jakarta Pusat,-6.18797,106.814334
17,Branch,KCP,KCP Tanah Abang Blok A,"Kios Pasar Tanah Abang Blok A Basement I/G-063, F-080, F-081",Jakarta Pusat,-6.18797,106.814334
18,Branch,KCP,KCP Tanah Abang Blok B,"Gedung Pasar Tanah Abang Blok B Lantai 5 Kios Nomor 3, 5, 6 Jl. KH Fachrudin No. 78, 80, 82",Jakarta Pusat,-6.18797,106.814334
19,Branch,KK,KK Kantor Kas Tanah Abang Blok A Lantai G,"Tanah Abang Blok A Lt. GF/F/065 dan GF/F/067, Tanah Abang",Jakarta Pusat,-6.18797,106.814334
20,Branch,KK,KK Kantor Kas TNB G,Tanah Abang Blok B G/H 001 & 002,Jakarta Pusat,-6.18797,106.814334
21,Branch,KK,KK Kantor Kas TNB L1,Tanah Abang Blok B 01/G078 & 087,Jakarta Pusat,-6.18797,106.814334
22,Branch,KCP,KCP Tanah Abang Zona 3,"Gedung Tanah Abang Zona III Lantai 3A L03A, Jl. KH. Fachrudin, Tanah Abang",Jakarta Pusat,-6.18659,106.81515
23,Branch,KCP,KCP MD Tower,Jl. Setiabudi Selatan No. 7,Jakarta Selatan,-6.208167,106.828396
24,Branch,KCP,KCP Pasar Tanah Abang,Jl. KH Fachrudin 36 Blok D/23,Jakarta Pusat,-6.185926,106.815121
25,Branch,KCP,KCP Penjernihan,Jl. Penjernihan I No. 23,Jakarta Pusat,-6.201069,106.80976
26,Branch,KCU,KCU SUDIRMAN,"Gedung Chase Plaza, Jl. Jend. Sudirman Kav. 21",Jakarta Selatan,-6.21041,106.821642
27,Branch,KCP,KCP Sahid Sudirman Residence,"The Office Sahid Sudirman Residence Lt. LG Unit 01, Jl. Jend. Sudirman No. 86",Jakarta Pusat,-6.210522,106.819205
28,Branch,KCP,KCP Gondangdia Lama,Jl. R.P. Soeroso No. 25,Jakarta Pusat,-6.191423,106.836229
29,Branch,KCP,KCP Sahid Sudirman Center,Sahid Sudirman Center Lantai Dasar Suite A Jl. Jend. Sudirman No. 86,Jakarta Pusat,-6.21086,106.81859
30,Branch,KCP,KCP City Center,"Kawasan Terpadu The City Center, Gedung Perkantoran Tower One, Ground Floor, Jl. KH.Mas Mansyur Kav. 126, Jakarta",Jakarta Pusat,-6.210999,106.81637
31,Branch,KCP,KCP Millennium Centennial,"Gedung Millennium Centennial Ground Floor Unit C, Jl. Jend. Sudirman Kav. 25, Jakarta",Jakarta Selatan,-6.2122,106.820506
32,Branch,KCP,KCP Menara Imperium,Jl. HR Rasuna Said Kav. 01,Jakarta Selatan,-6.210149,106.831541
33,Branch,KCP,KCP Kebon Sirih,"Plaza Pupuk Kaltim, Gedung B Lantai 1, Jl. Kebon Sirih No. 6A",Jakarta Pusat,-6.182471,106.831584
34,Branch,KCP,KCP Grha Surya,Jl. Setiabudi Selatan I Kav. 9,Jakarta Selatan,-6.212858,106.828948
35,Branch,KCP,KCP Sentral Cikini,Jl. Pegangsaan Timur No. 1 Menteng,Jakarta Pusat,-6.196977,106.840602
36,Branch,KCP,KCP WTC Sudirman,"World Trade Center I Sudirman, Jl. Jend. Sudirman Kav. 29",Jakarta Selatan,-6.214829,106.820051
37,Branch,KK,KK Kantor Kas Cikini Gold Center,"Jl. Pegangsaan Timur, Menteng Gedung Cikini Gold Center LGF/A/AKS032",Jakarta Pusat,-6.198229,106.841595
38,Branch,KCP,KCP Setiabudi Atrium,"Plaza Setiabudi, Gd.Setiabudi Atrium Lt.1 Suite 101 A, Jl.HR.Rasuna Said Kav.62, Kuningan",Jakarta Selatan,-6.214389,106.830081
39,Branch,KCP,KCP Benhil,Jl. Bendungan Hilir Raya No. 44/I,Jakarta Pusat,-6.213955,106.814376
40,Branch,KCP,KCP Sampoerna Strategic Square,"Gd. Sampoerna Strategic Square Tower A - Ground Floor, Jl. Jend. Sudirman Kav. 45-46",Jakarta Selatan,-6.216825,106.817843
41,Branch,KCP,KCP Plaza Sentral,Jl. Jend. Sudirman Kav.47,Jakarta Selatan,-6.216864,106.816482
42,Branch,KCP,KCP Raden Saleh,"Jl. Raden Saleh No. 13, 15, 17A",Jakarta Pusat,-6.190467,106.844052
43,Branch,KCP,KCP Tanah Abang 2,Jl. Tanah Abang II No. 49 & 51,Jakarta Pusat,-6.175651,106.814954
44,Branch,KCP,KCP Semanggi,"Wisma GKBI, Jl. Jend. Sudirman No. 28 Suite G 01",Jakarta Pusat,-6.217438,106.812883
45,Branch,KCP,KCP KS Tubun,"Gd.Graha Indramas Lt.dasar, Jl. AIP II KS Tubun Raya No. 77",Jakarta Barat,-6.200174,106.799838
46,Branch,KCP,KCP Abdul Muis,"Gedung Graha Motor City Level I Suite 101, Jl. Abdul Muis 24-26",Jakarta Pusat,-6.173697,106.820772
47,Branch,KCP,KCP Kwitang,Jl. Kwitang Raya No. 17,Jakarta Pusat,-6.180468,106.839989
48,Branch,KBNP,KBNP Universitas Atma Jaya,"Gedung G Lantai 1,  Jl. Jendral Sudirman 51",Jakarta Selatan,-6.219294,106.815492
49,Branch,KCP,KCP Wisma Barito,"Gedung Wisma Barito, Jl. Letjen S. Parman Kav. 62-63 Slipi",Jakarta Barat,-6.197868,106.798737
50,Branch,KCP,KCP Pasar Kenari,Jl. Kenari II/8,Jakarta Pusat,-6.19323,106.846644
51,Branch,KCP,KCP Epicentrum Walk,"Epicentrum Walk 2nd Floor W336A & 338A, Jl. Jend. HR. Rasna Said Kav C 17",Jakarta Selatan,-6.218109,106.835183
52,Branch,KK,KK Kantor Kas Plaza Kenari Mas,"Plaza Kenari Mas, Lt. 4 Blok K 37-38, Jl. Kramat Raya No. 101, Jakarta",Jakarta Pusat,-6.191024,106.848555
53,Branch,KCU,KCU WISMA ASIA,"Wisma Asia, Jl. S. Parman Kav. 79",Jakarta Barat,-6.189065,106.797371
54,Branch,KBNP,KBNP Atrium Senen,"Basement, Jl. Senen Raya No. 135, RW 2, Senen, Jakarta",Jakarta Pusat,-6.176618,106.841154
55,Branch,KCU,KCU SURYOPRANOTO,Jl. Suryopranoto 40,Jakarta Pusat,-6.170264,106.815584
56,Branch,KCP,KCP Ambasador,"Mal & Apartemen Ambasador No. R.18 Lantai Dasar, Jl. Prof Dr Satrio, Karet Kuningan ? Setiabudi",Jakarta Selatan,-6.22406,106.826843
57,Branch,KCP,KCP Kyai Caringin,Jl. Balikpapan No. 21 A-B,Jakarta Pusat,-6.17084,106.81212
58,Branch,KCP,KCP Wisma Slipi,"Gedung Wisma Slipi Lantai 1, Jl. Letjen S. Parman Kav. 12 Slipi",Jakarta Barat,-6.186753,106.796341
59,Branch,KCP,KCP Harmoni Plaza,"Ruko Harmoni Plaza Blok B No. 26-27, Jl. Suryopranoto 2",Jakarta Pusat,-6.168585,106.819354
60,Branch,KCP,KCP Senen,Pusat Grosir Senen Jaya Blok A8-9 Lantai 2,Jakarta Pusat,-6.175984,106.842361
61,Branch,KCP,KCP Menara Mulia,"Gedung Menara Mulia Lt. Dasar, Jl. Gatot Subroto Kav. 9-11",Jakarta Selatan,-6.224594,106.816808
62,Branch,KCP,KCP Tomang Raya,Jl. Tomang Raya 64,Jakarta Barat,-6.17515,106.803936
63,Branch,KCP,KCP Graha Paramita,"Gdg Graha Paramita Lobby Depan, Jl. Denpasar Raya Blok D-2",Jakarta Selatan,-6.224254,106.831414
64,Branch,KCP,KCP Atrium,Ruko Atrium Blok E No. 12-13,Jakarta Pusat,-6.174119,106.840893
65,Branch,KCP,KCP GAMA,"Gama Tower Lt. Dasar Unit B, Jl. HR Rasuna Said Kav. C-22, Karet Kuningan",Jakarta Selatan,-6.224657,106.833642
66,Branch,KCP,KCP Duta Merlin,"Komp. Duta Merlin Blok A No. 24-25, Jl. Gajah Mada 3-5",Jakarta Pusat,-6.166061,106.82005
67,Branch,KCP,KCP Bursa Efek Jakarta,"Gd. Bursa Efek Jakarta, Tower II G-09 & 108, Jl. Jend. Sudirman Kav. 52-53",Jakarta Selatan,-6.224205,106.808707
68,Branch,KCP,KCP Mega Kuningan,Gedung Oakwood Premier Cozmo Jl. Lingkar Mega Kuningan Blok E 4.2 No. 1,Jakarta Selatan,-6.227783,106.825408
69,Branch,KCP,KCP Cyber 2,"Gedung Cyber 2 Ground Floor, Jl. HR. Rasuna Said Kav. X-5 No. 13",Jakarta Selatan,-6.22644,106.832354
70,Branch,KCP,KCP Mandala Raya,Jl. Mandala Raya 14,Jakarta Barat,-6.17585,106.799245
71,Branch,KCU,KCU MATRAMAN,Jl. Matraman Raya 14-16,Jakarta Timur,-6.20043,106.854553
72,Branch,KCP,KCP Biak,Jl. Biak No. 44 AB,Jakarta Pusat,-6.168088,106.808309
73,Branch,KCP,KCP Menara Palma,"Gedung Menara Palma - Ground Floor, Jl. HR Rasuna Said Blok X2 Kav. 6",Jakarta Selatan,-6.226956,106.833638
74,Branch,KCP,KCP Hasyim Ashari,Jl. KH H. Ashari 5 AA,Jakarta Pusat,-6.164772,106.818433
75,Branch,KCP,KCP Kemanggisan,Jl. Kemanggisan Utama Raya 37,Jakarta Barat,-6.18975,106.79098
76,Branch,KCP,KCP Cideng Barat,Jl. Cideng Barat 53,Jakarta Pusat,-6.189657,106.790778
77,Branch,KCP,KCP Pintu Air,Jl. Pintu Air 36 Q,Jakarta Pusat,-6.165307,106.832158
78,Branch,KCU,KCU SCBD,"Equity Tower Ground Floor Unit D & Lantai 8 Unit E, Jl. Jend. Sudirman Kav. 52-53 Lot 9",Jakarta Selatan,-6.226296,106.808435
79,Branch,KCP,KCP Juanda III,Jl. Ir. Juanda III No. 34,Jakarta Pusat,-6.163805,106.823638
80,Branch,KCP,KCP Saharjo,Jl. Dr. Saharjo 149 G-H,Jakarta Selatan,-6.219974,106.846164
81,Branch,KCP,KCP Alaydrus,Jl. Alaydrus 48 B,Jakarta Pusat,-6.164228,106.816287
82,Branch,myBCA,myBCA Kota Kasablanka,"Mal Kota Kasablanka, Lantai 2",Jakarta Selatan,-6.223468,106.842847
83,Branch,KCP,KCP Gatot Subroto,"Centennial Tower lantai GF unit C, Jl. Gatot Subroto Kav 24-25",Jakarta Selatan,-6.23023,106.820468
84,Branch,KCP,KCP Sopo Del,"Gedung Sopo Del Office Tower A Lantai GF-15, Jl. Mega Kuningan Barat III Lot 10.1-6, Jakarta",Jakarta Selatan,-6.230391,106.823903
85,Branch,KK,KK Kantor Kas Kota Kasablanka,"Mal Kota Kasablanka LG 103, Jl. Kasablanka Raya Kav. 88",Jakarta Selatan,-6.224164,106.842548
86,Branch,KCP,KCP Sudirman Mansion,Sudirman Mansion Lt. G No. G-A Blk C Jl. Jend. Sudirman Kav 59 No. 77,Jakarta Selatan,-6.226158,106.805693
87,Branch,KCP,KCP Roxy Mas,"Komplek Ruko Roxy Mas, Jl. K.H. Hasyim Ashari Blok C.5 No. 6 - 8",Jakarta Pusat,-6.168173,106.804107
88,Branch,KCP,KCP Batu Ceper,Jl. Batu Ceper Raya 18 A-B,Jakarta Pusat,-6.162541,106.823096
89,Branch,KCP,KCP Mal Taman Anggrek,"Lower Ground Lot. C 07, Jl. S. Parman Kav. 21, Slipi",Jakarta Barat,-6.179269,106.792753
90,Branch,KCP,KCP AM Sangaji,Jl. AM Sangaji No. 020 A Rt. 003/04,Jakarta Pusat,-6.163531,106.81228
91,Branch,KCU,KCU PASAR BARU,Jl. KH Samanhudi 8,Jakarta Pusat,-6.162447,106.828941
92,Branch,KCP,KCP Pecenongan,Jl. Pecenongan 86,Jakarta Pusat,-6.162141,106.826926
93,Branch,KCP,KCP Cideng Timur,Jl. Cideng Timur 11 F,Jakarta Pusat,-6.164007,106.810692
94,Branch,KCP,KCP ITC Roxi Mas,"ITC Roxy Mas Basement 13, Jl. KH. Hasyim Ashari 125",Jakarta Pusat,-6.167056,106.803446
95,Branch,KCP,KCP Tomang Tol,Jl. Arjuna Kav. 8 A/1,Jakarta Barat,-6.184351,106.789424
96,Branch,KCP,KCP Summitmas,"Summitmas I Lt. Dasar, Jl. Jend. Sudirman Kav. 61-62",Jakarta Selatan,-6.226587,106.803737
97,Branch,KCP,KCP Sawah Besar,Jl. Sukarjo Wiryopranoto 28 C,Jakarta Pusat,-6.160891,106.823321
98,Branch,KCP,KCP Kramat Jaya Baru,Jl. Percetakan Negara II No. 16 B-C,Jakarta Pusat,-6.183109,106.856095
99,Branch,KCP,KCP Jembatan Lima,Jl. KH. Moch. Mansyur 15 F,Jakarta Pusat,-6.163785,106.80776
100,Branch,KCP,KCP Ratu Plaza,Jl. Jend. Sudirman Lantai Dasar,Jakarta Pusat,-6.226598,106.801269
101,Branch,KCP,KCP Ketapang,"Komp.Ketapang Indah Blok A/3-4, Jl. KH Zainal Arifin",Jakarta Barat,-6.160241,106.818005
102,Branch,myBCA,myBCA Central Park,"Mal Central Park, Lantai LG",Jakarta Barat,-6.177619,106.791107
103,Branch,KCP,KCP Metro Pasar Baru,"Gedung Metro Pasar Baru Lt. Dasar No. 101, 102, 103, Jl. Samanhudi",Jakarta Pusat,-6.160989,106.832332
104,Branch,KCU,KCU KUNINGAN,"Gedung Menara Karya Ground Floor, Jl. HR Rasuna Said Blok X-5 Kav. 1-2",Jakarta Selatan,-6.23317,106.831157
105,Branch,KCP,KCP Palmerah,Jl. Palmerah Barat 38 A,Jakarta Barat,-6.206954,106.786319
106,Branch,KCP,KCP Duri Raya,Jl. Duri Raya 37 B,Jakarta Barat,-6.161346,106.807803
107,Branch,KCP,KCP Central Park,"Kawasan Superblok Podomoro City (Central Park) Ruko Garden Shopping Arcade Blok B/08/CB,CC,CD Jl. S. Parman, Jak Bar",Jakarta Barat,-6.17594,106.79014
108,Branch,KCP,KCP Krekot Bunder,"Jl. Krekot Bunder Raya No.28, Pasar Baru, Jakarta",Jakarta Pusat,-6.159331,106.832051
109,Branch,KCP,KCP Wisma Mulia,"Wisma Mulia Suite G02, Jl. Gatot Subroto No. 42",Jakarta Selatan,-6.235411,106.823371
110,Branch,KCP,KCP Hayam Wuruk,Jl. Hayam Wuruk 54,Jakarta Barat,-6.158148,106.819148
111,Branch,KCP,KCP Tebet,"Gedung Gajah Tebet Unit N & O, Jl. Dr. Sahardjo Raya 111",Jakarta Selatan,-6.226517,106.847608
112,Branch,KCP,KCP Tempo Scan Tower,Jl. HR Rasuna Said Kav. 3-4,Jakarta Selatan,-6.235103,106.828911
113,Branch,KCP,KCP Bungur,Jl. Bungur Besar Raya 32 & 32A,Jakarta Pusat,-6.160921,106.839413
114,Branch,KCP,KCP Samanhudi,Jl. Samanhudi 57 B,Jakarta Pusat,-6.159357,106.835912
115,Branch,KCP,KCP Senayan City,"Mall Senayan City Unit 6-09A, Jl. Asia Afrika Lot 19, Jakarta",Jakarta Pusat,-6.227553,106.797543
116,Branch,KCP,KCP Taman Sari,Jl. Taman Sari 47-47A,Jakarta Barat,-6.15695,106.82707
117,Branch,KCP,KCP Bina Nusantara,"Kamp. II Univ. Bina Nusantara, Jl. Anggrek Cakra 10, Kebon Jeruk",Jakarta Barat,-6.201954,106.781811
118,Branch,KCU,KCU GUNSA 45,Jl. Gunung Sahari 45,Jakarta Pusat,-6.158124,106.837256
119,Branch,KBNP,KBNP Universitas Ukrida,Jl. Tanjung Duren Raya No. 4,Jakarta Barat,-6.17285,106.78857
120,Branch,KCP,KCP Tendean,Jl. Wolter Monginsidi No. 129,Jakarta Selatan,-6.238642,106.817525
121,Branch,KCP,KCP Permata Hijau,Pertokoan Permata Hijau Blok D No. C27-28 dan B22,Jakarta Selatan,-6.220782,106.78771
122,Branch,KCP,KCP Kartika Towers,"Gedung Kartika Tower Lantai Dasar Blok GF No.09, Jl. Kyai Tapa No. 101, Jakarta Barat",Jakarta Barat,-6.167111,106.792139
123,Branch,KCP,KCP Jamblang,Jl. Jamblang Raya 51,Jakarta Barat,-6.157398,106.806276
124,Branch,KCP,KCP Percetakan Negara,Jl. Percetakan Negara No. 223 C,Jakarta Pusat,-6.187793,106.864653
125,Branch,KCP,KCP Tanjung Duren 2,Jl. Tanjung Duren Raya RT 001/06 Blok A11 No. 6A,Jakarta Barat,-6.179063,106.783533
126,Branch,KCP,KCP Tanjung Duren,Jl. Tanjung Duren 3,Jakarta Barat,-6.173654,106.78628
127,Branch,KCP,KCP Untar,"Kampus I Universitas Tarumanagara Blok I, Jl. Letjen S. Parman No. 1",Jakarta Barat,-6.169134,106.789462
128,Branch,KBNP,KBNP Trisakti,"Gedung K Lantai Dasar Kampus A Universitas Trisakti, ?Jl. Kyai Tapa No. 1",Jakarta Barat,-6.168505,106.789922
129,Branch,KCP,KCP Karanganyar,Jl. Karang Anyar Blok A1 No. 14-15,Jakarta Pusat,-6.153645,106.827624
130,Branch,KCU,KCU GAJAH MADA,Jl. Gajah Mada 112 B-C-D,Jakarta Barat,-6.153431,106.817471
131,Branch,KCP,KCP Grogol Muwardi,Jl. Muwardi 1/44,Jakarta Barat,-6.164356,106.792978
132,Branch,KCP,KCP Arjuna,Jl. Arjuna Utara No. 7 D-E,Jakarta Barat,-6.185837,106.779947
133,Branch,KCP,KCP Santa,Jl. Wolter Monginsidi 54,Jakarta Selatan,-6.239204,106.811014
134,Branch,KCP,KCP KHM Mansyur,Jl. KHM Mansyur 246 A & B,Jakarta Barat,-6.154812,106.80804
135,Branch,KCP,KCP Mangga Besar VIII,Jl. Mangga Besar VIII No.12 A-F,Jakarta Barat,-6.152349,106.825449
136,Branch,KCP,KCP Tebet Barat 2,Jl. Tebet Raya No. 25 B Blok CI Tebet,Jakarta Selatan,-6.229449,106.852982
137,Branch,KK,KK Kantor Kas Untar II,"Kampus II Universitas Tarumanegara, Jl. Arteri S. Parman",Jakarta Barat,-6.169391,106.7871
138,Branch,KCP,KCP Mandala,Jl. Hayam Wuruk No. 111,Jakarta Barat,-6.151558,106.817551
139,Branch,KCP,KCP Mal Ciputra,"Mal Ciputra LG II No. 24-28, Jl. Arteri S. Parman, Slipi",Jakarta Barat,-6.168533,106.786658
140,Branch,KCP,KCP Soepomo,"Gedung Alun Graha Lt. Dasar, Jl. Prof. Dr. Soepomo SH No. 233, RT 007 RW 01, Menteng Dalam, Tebet",Jakarta Selatan,-6.237313,106.844152
141,Branch,KCP,KCP ITC Permata Hijau,"Grand Permata Hijau Type Emerald No. 12 & 14, Jl. Arteri Permata Hijau",Jakarta Selatan,-6.220786,106.783382
142,Branch,KCP,KCP Keamanan,Jl. Keamanan 50,Jakarta Barat,-6.151211,106.815255
143,Branch,KCP,KCP Jatinegara Barat,"Jl. Jatinegara Barat 54 E, Blok C 1-4",Jakarta Timur,-6.218017,106.864452
144,Branch,KCP,KCP Cempaka Putih,Jl. Letjen Suprapto No.30 EF,Jakarta Pusat,-6.17237,106.863017
145,Branch,KCP,KCP KEM Tower,"Gedung KEM Tower, Jl. Landas Pacu Barat Blok B Kav. 2",Jakarta Pusat,-6.155118,106.844796
146,Branch,KK,KK Kantor Kas Pasar Jatinegara,Pasar Jatinegara Blok A Lantai L03 Los AKS No. 023,Jakarta Timur,-6.216342,106.865986
147,Branch,KCP,KCP Pasar Jatinegara,Jl. Pintu Pasar Timur No. 14 & 16 Jatinegara,Jakarta Timur,-6.216358,106.865991
148,Branch,KCP,KCP Gudang Peluru,"Komp. Gudang Peluru Blok A No. 23, Jl. Kampung Melayu Besar",Jakarta Selatan,-6.225661,106.860545
149,Branch,KCP,KCP Mangga Besar,Jl. Raya Mangga Besar 15,Jakarta Barat,-6.149269,106.819104
150,Branch,KCP,KCP Citra Towers,"Citra Towers, North Tower Lt 01 No. Unit 01/GF, Jl. Benyamin Suaeb Kavling A6, Kemayoran, Jakarta Pusat",Jakarta Pusat,-6.158222,106.851999
151,Branch,KCU,KCU MENARA BIDAKARA,"Menara Bidakara Lt. Lobby dan Lt. 1, Jl. Gatot Subroto Kav.71-73",Jakarta Selatan,-6.241712,106.840962
152,Branch,KCP,KCP Mangga Besar Raya,Jl. Mangga Besar Raya 128,Jakarta Pusat,-6.148479,106.829839
153,Branch,KCP,KCP Kartini,"Komplek Apartemen Grand Kartini, Ruko No. 18 Jl. Kartini Raya No. 57",Jakarta Pusat,-6.149236,106.833912
154,Branch,KCP,KCP Utan Kayu,Jl. Utan Kayu 94,Jakarta Timur,-6.196541,106.872038
155,Branch,KCP,KCP Jembatan Merah,Jl. Mangga Besar 177 C,Jakarta Barat,-6.148743,106.833651
156,Branch,KCP,KCP Rawasari,Jl. Rawasari Selatan No. 24 A,Jakarta Pusat,-6.185788,106.871107
157,Branch,KCP,KCP Tebet Barat,Jl. Tebet Barat IX/40,Jakarta Selatan,-6.238734,106.848794
158,Branch,KCP,KCP Jembatan Merah,Jl. Merdeka No. 50,Bogor,-6.148255,106.832893
159,Branch,KCP,KCP Hasanudin,Jl. Hasanudin 43/48,Jakarta Selatan,-6.241838,106.802093
160,Branch,KCP,KCP Jatinegara Timur,"Jl. Jatinegara Timur No.37 Pav RT.008 RW.04, Balimester, Jatinegara, Jakarta Timur",Jakarta Timur,-6.218257,106.867636
161,Branch,KCP,KCP Lokasari,"Komp. Lokasari Plaza Blok B 45, Jl. Mangga Besar 81",Jakarta Barat,-6.147071,106.823988
162,Branch,KCP,KCP Daan Mogot Dua,Jl. Daan Mogot No. 48 A,Jakarta Barat,-6.164994,106.783407
163,Branch,KCP,KCP Grogol Permai,"Pert.Grogol Permai Blok F 3-4, Jl. Prof. Latumenten",Jakarta Barat,-6.156529,106.79201
164,Branch,KCP,KCP Seasons City,Komp. Ruko Season City Blok E No. 8-9 Jembatan Besi,Jakarta Barat,-6.153306,106.796481
165,Branch,KCP,KCP KHM Mansyur II,"Jl. KHM. Mansyur No. 69, Krendang, Tambora, Jakarta Barat",Jakarta Barat,-6.148137,106.807313
166,Branch,KCP,KCP Kepa Duri,Jl. Mangga Raya 20,Jakarta Barat,-6.173069,106.777133
167,Branch,KCP,KCP Lindeteves Trade Center,"Gedung Lindeteves Trade Center Ruko RA 33 - 35 - 36, Jl.Hayam Wuruk 127",Jakarta Barat,-6.145985,106.816327
168,Branch,KK,KK Kantor Kas Green Pramuka,"Mall Green Pramuka Lt. UG No. 09, Jakarta",Jakarta Timur,-6.189171,106.873827
169,Branch,KCP,KCP Warung Buncit,"Gedung Multika, Jl. Mampang Prapatan Raya 71-73",Jakarta Selatan,-6.248684,106.826912
170,Branch,KCP,KCP Tebet Timur,Jl. Tebet Timur Dalam Blok GG No. 97,Jakarta Selatan,-6.236064,106.857175
171,Branch,KCP,KCP Lindeteves,"Gedung Hayam Wuruk Indah Lt 1 Blok A-L 01,CKS 056, Jl.Hayam Wuruk 100",Jakarta Barat,-6.144963,106.81604
172,Branch,KCP,KCP Jelambar,"Kavling Polri, Jl. Hadiah Blok B-7 No.706",Jakarta Barat,-6.159566,106.785244
173,Branch,KCP,KCP Relasi Indah,Jl. Panjang No.11 (Arteri Kelapa Dua),Jakarta Barat,-6.203313,106.769141
174,Branch,KCP,KCP Jalan Panjang,Jl. Panjang 79 EF,Jakarta Barat,-6.20348,106.769127
175,Branch,KCP,KCP Glodok Plaza,"Pertokoan Glodok Plaza Blok E/7-8, Jl. Pinangsia Raya 1",Jakarta Barat,-6.143133,106.817548
176,Branch,KCP,KCP Jelambar Baru Raya,Jl. Jelambar Baru Raya 53 C,Jakarta Barat,-6.155271,106.787984
177,Branch,KCU,KCU WISMA MILLENIA,Jl. MT. Haryono Kav. 16,Jakarta Selatan,-6.242855,106.851503
178,Branch,KCP,KCP Ricci,"Sekolah Ricci, Jl. Kemenangan III/70",Jakarta Barat,-6.14338,106.811567
179,Branch,KBNP,KBNP Alfamidi Bangka,"Jl. Bangka Raya No. 100 RT. 01 RW 12, Kel. Pela Mampang, Mampang Prapatan, Jakarta Selatan",Jakarta Selatan,-6.250565,106.814327
180,Branch,KK,KK Kantor Kas Pasar Mayestik,"Pasar Mayestik, Jl. Tebah Raya I Lt. 2 Blok BKS No. 9 dan 10 Kebayoran Baru",Jakarta Selatan,-6.241132,106.790782
181,Branch,KCU,KCU PANGERAN JAYAKARTA,Jl. Pangeran Jayakarta No. 127,Jakarta Pusat,-6.142495,106.829433
182,Branch,KCP,KCP PRJ Kemayoran,Gedung Pusat Niaga Lt. 1 Wing Barat Arena PRJ Kemayoran,Jakarta Pusat,-6.146811,106.845143
183,Branch,KCP,KCP Mayestik,"Jl. Kiai Maja 77, Kebayoran Baru",Jakarta Selatan,-6.241983,106.791431
184,Branch,KCP,KCP Cempaka Putih Raya,"Jl. Cempaka Putih Raya No. 118 B,C,D",Jakarta Pusat,-6.176823,106.874554
185,Branch,KCP,KCP Blok M,"Jl. Melawai Raya B-10/165 RT.004 / RW.01, Melawai?Kebayoran Baru",Jakarta Selatan,-6.245911,106.796648
186,Branch,KCU,KCU KEBAYORAN BARU,Jl. Melawai Raya Blok B No. III RT. 007 / RW. 005 Kebayoran Baru,Jakarta Selatan,-6.245924,106.796635
187,Branch,KCP,KCP Jayakarta,Jl. P. Jayakarta 26 Blok A/2-3,Jakarta Pusat,-6.141101,106.825123
188,Branch,KK,KK Kantor Kas Kalbis Institute,Gedung Institute Teknologi & Bisnis Kalbe Jl. Pulo Mas Selatan 22/11,Jakarta Timur,-6.179075,106.876529
189,Branch,KCP,KCP Gunung Sahari,"Pert.Gunung Sahari Indah Blok B/11-12, Jl. Raya Gunung Sahari 13",Jakarta Utara,-6.141058,106.833503
190,Branch,KCP,KCP Rajawali,Jl. Rajawali Selatan Raya Blok C5 No. 2 Rukan Multi Guna Blok 2,Jakarta Utara,-6.144159,106.844278
191,Branch,KCP,KCP Latumenten,Jl. Prof. Dr. Latumenten 28,Jakarta Barat,-6.147527,106.793767
192,Branch,KCP,KCP Angke,Jl. Tubagus Angke No. 37,Jakarta Barat,-6.142288,106.80519
193,Branch,KCP,KCP Pinangsia,Jl. Pinangsia II No. 3 & 3A,Jakarta Barat,-6.139967,106.814679
194,Branch,KCP,KCP Mangga Dua Square,"Komp. Ruko Mangga Dua Square Blok G No. 8-9, Jl. Gunung Sahari Raya",Jakarta Utara,-6.140185,106.832452
195,Branch,KCP,KCP Ruko Swadaya,"Jl. Swadaya Raya No. 39 Ruko Swadaya City Square Blok 1 No. 11-23, Grogol Petamburan",Jakarta Barat,-6.161022,106.777549
196,Branch,KCP,KCP Perniagaan Timur,Jl. Perniagaan Timur 35,Jakarta Barat,-6.140662,106.810056
197,Branch,KCP,KCP Psr. Kebayoran Lama,Jl. Kebayoran Lama 174,Jakarta Selatan,-6.23619,106.780302
198,Branch,KCP,KCP Otista,Jl. Otista No. 109,Jakarta Timur,-6.233932,106.867615
199,Branch,KCP,KCP Kedoya Baru,Ruko Tomang Tol Raya Blok A 1/21-22,Jakarta Barat,-6.189668,106.764299
